{
  "$schema": "loop_config.schema.json",
  "paths": {
    "sessionsRoot": ".goal/sessions",
    "registryFileName": "sessions_registry.json",
    "variantsConfigFileName": "model_variants.json",
    "loopHistoryDirName": "loop_history",
    "sessionFileNames": {
      "state": "loop_state.json",
      "progressNotes": "progress_notes.txt",
      "finalSummary": "final_summary.json",
      "plan": "plan.md",
      "planChoices": "plan_choices.json",
      "planOverview": "plan_options.md",
      "planOptionsDir": "plan_options",
      "interruptMessage": "interrupt_message.txt",
      "stopRequest": "stop_request.txt"
    },
    "roomFileNames": {
      "state": "state.json",
      "skills": "skills.json",
      "input": "input.json",
      "output": "output.json"
    },
    "roomDirNames": {
      "planner": "0_planner",
      "implementer": "1_implementer",
      "tester": "2_tester",
      "qa_lead": "3_qa_lead",
      "master": "4_master",
      "interrupter": "5_interrupter"
    },
    "controlDirName": "control",
    "ownerLockFileName": "session_owner.lock",
    "stateLockFileName": "state_write.lock",
    "leaseFileName": "session_lease.json",
    "registryLockFileName": "registry.lock",
    "attemptLogsDirName": "attempt_logs"
  },
  "defaults": {
    "cliBinary": "opencode",
    "maxIterations": 20,
    "phaseTimeoutMs": 900000,
    "idleTimeoutMs": 300000,
    "ptyCols": 100000,
    "ptyRows": 50,
    "transportTimeoutMs": 120000,
    "toolTimeoutMs": 600000,
    "maxAgentAttempts": 3,
    "maxCompletionRecoveryAttempts": 1,
    "maxAutomaticRecoveryCycles": 3,
    "automaticRecoveryBackoffMs": [
      60000,
      300000,
      900000
    ],
    "retryBackoffMs": [
      5000,
      30000
    ],
    "phaseRecoveryBudgetMs": 2880000,
    "terminationGraceMs": 3000,
    "killTimeoutMs": 5000,
    "heartbeatIntervalMs": 5000,
    "leaseTtlMs": 20000,
    "maxInMemoryOutputBytes": 1048576,
    "profileFallbackModels": {
      "opencode": "opencode/big-pickle",
      "kilo": "anthropic/claude-sonnet-4-5",
      "_default": "anthropic/claude-sonnet-4-5"
    }
  },
  "cliProfiles": {
    "opencode": {
      "defaultBinary": "opencode",
      "modelsArgs": [
        "models"
      ],
      "interactionWhitelist": [
        "Apply changes? [y/n]",
        "Apply changes? (y/n)",
        "Continue? [y/n]",
        "Continue? (y/n)",
        "Proceed? [y/n]",
        "Proceed? (y/n)",
        "Allow? [y/n]",
        "Allow? (y/n)",
        "Overwrite? [y/n]",
        "Confirm? [y/n]",
        "Do you want to continue? [y/n]",
        "Do you want to apply"
      ],
      "extraInteractionPatterns": []
    },
    "kilo": {
      "defaultBinary": "kilo",
      "modelsArgs": [
        "models"
      ],
      "interactionWhitelist": [
        "Apply changes? [y/n]",
        "Apply changes? (y/n)",
        "Continue? [y/n]",
        "Continue? (y/n)",
        "Proceed? [y/n]",
        "Proceed? (y/n)",
        "Allow? [y/n]",
        "Allow? (y/n)",
        "Overwrite? [y/n]",
        "Confirm? [y/n]",
        "Do you want to continue? [y/n]",
        "Do you want to apply",
        "Action Required",
        "Run Command (y)",
        "Allow (y)"
      ],
      "extraInteractionPatterns": [
        "Action Required",
        "Run Command (y)",
        "Allow (y)"
      ]
    }
  },
  "providers": {
    "opencode": {
      "label": "OpenCode",
      "adapter": "opencode",
      "binary": "opencode",
      "enabled": true,
      "modelsArgs": [
        "models"
      ],
      "fallbackModels": [
        "opencode/big-pickle"
      ]
    },
    "kilo": {
      "label": "Kilo Code",
      "adapter": "kilo",
      "binary": "kilo",
      "enabled": true,
      "modelsArgs": [
        "models",
        "--pure"
      ],
      "fallbackModels": [
        "anthropic/claude-sonnet-4-5"
      ]
    },
    "codex": {
      "label": "OpenAI GPT / Codex",
      "adapter": "codex",
      "binary": "codex",
      "enabled": true,
      "modelsArgs": [],
      "fallbackModels": [
        "gpt-5.6-sol",
        "gpt-5.6-terra",
        "gpt-5.6-luna"
      ]
    },
    "claude": {
      "label": "Anthropic Claude Code",
      "adapter": "claude",
      "binary": "claude",
      "enabled": true,
      "modelsArgs": [],
      "fallbackModels": [
        "sonnet",
        "opus"
      ]
    }
  },
  "toolAccess": {
    "webSearch": {
      "enabled": true,
      "mode": "live"
    },
    "mcpServers": []
  },
  "destructivePrompts": [
    "Delete",
    "Remove all",
    "Destroy",
    "Force overwrite",
    "git clean",
    "git checkout --",
    "git reset --hard",
    "Drop table",
    "Drop database"
  ],
  "variantDefaults": {
    "anthropic": [
      "high",
      "max"
    ],
    "openai": [
      "none",
      "minimal",
      "low",
      "medium",
      "high",
      "xhigh"
    ],
    "google": [
      "low",
      "high"
    ],
    "gemini": [
      "low",
      "high"
    ],
    "opencode": [
      "none",
      "minimal",
      "low",
      "medium",
      "high",
      "xhigh"
    ],
    "opencode-go": [
      "none",
      "minimal",
      "low",
      "medium",
      "high",
      "xhigh"
    ],
    "kilo": [
      "none",
      "minimal",
      "low",
      "medium",
      "high",
      "xhigh"
    ],
    "deepseek": [
      "low",
      "medium",
      "high",
      "max"
    ]
  }
}